{
  "schemaVersion": "1.0.0", "requestId": "frame-1", "sceneRevision": 0, "geometryRevision": 0,
  "poseTick": 0, "backendId": "synthetic-fixture", "backendVersion": "1.0.0",
  "sourceId": "source-ball", "listenerId": "listener-main", "bandCentersHz": [1000], "gainQuantity": "pressureRatio",
  "capabilities": ["directParameters"], "modelClass": "unverified", "directDelayS": null,
  "paths": [], "pathAvailability": "unsupported", "impulseResponseArtifactId": null,
  "stale": false, "limitations": ["僅驗證 schema，不是實際聲學結果"]
}
